{
  "schema_version": 1,
  "id": "ExampleTransform",
  "name": "Component Transform",
  "author": "Your name",
  "description": "SDK example; test in a development save",
  "version": "1.0.0",
  "api": "^1.0.0",
  "dependencies": {
    "BladesongModFramework": "^0.1.0"
  },
  "capabilities": [
    "component.transform"
  ],
  "files": []
}