{
  "schema_version": 1,
  "id": "ExampleData",
  "name": "Persistent Data",
  "author": "Your name",
  "description": "SDK example; test in a development save",
  "version": "1.0.0",
  "api": "^1.0.0",
  "dependencies": {
    "BladesongModFramework": "^0.1.0"
  },
  "capabilities": [],
  "files": [],
  "settings": {
    "saved": {
      "type": "table",
      "default": {
        "count": 0
      }
    }
  }
}